{
  "schemaVersion": 1,
  "lab": "foundational-track/java-foundations/java-basics/coding-lab",
  "record": "solved at b54d9142b1e94e4bf04961422a4d72056863b1da by run local-1791919563",
  "commit": "b54d9142b1e94e4bf04961422a4d72056863b1da",
  "runId": "local-1791919563",
  "ranAt": "2026-10-13T19:26:03Z",
  "environment": {
    "os": "macOS 26.7.1 (Darwin 25.6.0, arm64)",
    "jdk": "Eclipse Temurin 25.0.4.1+1",
    "maven": "Apache Maven 3.9.16"
  },
  "procedure": [
    "Exported the lab files of the named commit with git archive into uncommitted private staging outside the repository.",
    "Replaced only starter/src/main/java/basics/Basics.java with the privately staged completed program; the public tests were byte-identical to the commit.",
    "Ran the setup command mvn -q dependency:go-offline in starter/ against an empty local Maven repository, then the test command mvn -q -o test."
  ],
  "result": "mvn -q -o test exited 0 with no output; surefire report: Tests run: 6, Failures: 0, Errors: 0, Skipped: 0.",
  "starterRun": "On the shipped starter, mvn -q -o test exits 1 and fails all six declared failingTests (Tests run: 6, Failures: 6), each listing the inputs that gave wrong results (checked on 2026-10-13 with an empty local Maven repository after setup).",
  "cleanup": "The runs created only starter/target inside the lab, which the documented cleanup removes.",
  "otherSystems": "Linux and Windows runs are not yet recorded; CI covers Ubuntu (lab-contract section 10).",
  "artifactHashes": {
    "README.md": "9d687a67bb7a191eeb70a536e508e8435661e0bf18a59aba8ea41df549426ba6",
    "expected/test-summary.txt": "e1f5e74ebb2384aca3e27731f6d4cde10b03f8c89cd241d5a4527b349a9e61e0",
    "lab.json": "df6ab8cdccde86d83f312e70e50b28bb156e7ca952e9b574cc0e09dfd62caa68",
    "starter/pom.xml": "d140dfda0af39163dd55b5183e831f25d5ea204d5b17785c7d3f2c3e98cffd58",
    "starter/src/main/java/basics/Basics.java": "345916e5df6c8e97ab8ad4297d01cc68d8589c949e6918552f19089da866e84b",
    "tests/basics/BasicsTest.java": "05bc770d109ef1403ff24ed34fa7d16de0d4ced409482c3a98b70a24827287d8"
  },
  "testScope": "The public tests check only the results each method returns for the listed inputs and edge cases; they do not check which Java constructs the code uses."
}
